"HITId","HITTypeId","Title","Description","Keywords","Reward","CreationTime","MaxAssignments","RequesterAnnotation","AssignmentDurationInSeconds","AutoApprovalDelayInSeconds","Expiration","NumberOfSimilarHITs","LifetimeInSeconds","AssignmentId","WorkerId","AssignmentStatus","AcceptTime","SubmitTime","AutoApprovalTime","ApprovalTime","RejectionTime","RequesterFeedback","WorkTimeInSeconds","LifetimeApprovalRate","Last30DaysApprovalRate","Last7DaysApprovalRate","Input.image_url","Answer.column","Approve","Reject"
"3SBX2M1TKCMG7NY8KY98YDRS4584QV","3PFYYPJUJW4Z7TTVX8EEH7YSDOZZ2H","Transcribe the text from a Column of a Palauan Language Dictionary","We're trying to digitize a scanned dictionary of an endangered Pacific Island language","image, write, transcription, dictionary, palau, palauan, language","$0.30","Tue Dec 30 17:24:54 GMT 2014","1","BatchId:1776840;","3600","86400","Tue Jan 06 17:24:54 GMT 2015","","","3DL65MZB8DEXR8JCUOPSCE9MM3WCEV","A3I3P2U0AS6RD4","Approved","Wed Dec 31 01:38:55 GMT 2014","Wed Dec 31 02:07:50 GMT 2014","Wed Dec 31 18:07:50 PST 2014","Wed Dec 31 09:01:08 PST 2014","","","1735","100% (1/1)","100% (1/1)","100% (1/1)","http://tekinged.com/png-halves/dict-070-left.png","bekeskesib v.s. prone to sweating. See kesib--bekesbesib a rengul easily angered; touchy bekesulaul v.s. get sleepy easily. See mesulaul. 
bekesuul v.s. chronically lying or misrepresenting. See mengesuul. 
beketall v.a.s. is to be unwrapped, unravelled, unwound or undone. See omoket.
beketaut v.s. good at shooting. See taut. ant. bekiit. --beketaut et tekol words which are right to the point. --beketaut a tekingel incisive; speaking to the point.
beketbotb v.s. eloquent; capable of explaining things in detail. See melbotb.
beketechetoched v.s.redup. giving up easily. See tmoched.
beketechilr v.s. good at grasping or comprehending things.
beketekol v.s. talkative. See tekoi. --bleketekoi n.r.s. talkativeness --bekeketekoi v.s.redup. rather talkative. --oubeketekoi v.t. talk constantly about (something).
beketelechelubel v.s. bathe or take showers often. See telechelubel.
beketertord v.s.redup. easily irritated or frustrated. See tord.
beketerturech v.s.redup. smell like urine. See turech.
beketimel v.s. slow-moving; slow (in running). See betimel.
beketimer v.s. syn. beketimel
beketingaol v.s. prone to lying. See tingaol.
beketiochel v.s. (plant, person, etc.) productive. See tiochel
beketung(e)l v.s. have a keen sense of smell. See melung(e)l.
beketurech v.s. smell like urine. See turech.
bekeu v.s.brave; courageous. --blekeu n.r.s. bravery; courage. --oubekeu v.t. pretend (oneself) to be brave. --Bekeulbechab n. name of brave Palauan warrior. --Tbekculiaes n. name of hill near Ngerubesang.
bekeuel v.s. smell of turtle (after eating turtle). See uel.
Bekeulbechab n. name of brave Palauan warrior. See bekeu.
bekl-ul stem n. poss. See bekai.
bekldokel v.s. easily soiled. See idokel."
"3X0EMNLXEOOU1OG84HV67Y1VCTJVP7","3PFYYPJUJW4Z7TTVX8EEH7YSDOZZ2H","Transcribe the text from a Column of a Palauan Language Dictionary","We're trying to digitize a scanned dictionary of an endangered Pacific Island language","image, write, transcription, dictionary, palau, palauan, language","$0.30","Tue Dec 30 17:24:54 GMT 2014","1","BatchId:1776840;","3600","86400","Tue Jan 06 17:24:54 GMT 2015","","","3SKEMFQBZ34Y15L99YKQ8NQ8G81K89","AQDOCXT1VPDVF","Approved","Tue Dec 30 19:25:50 GMT 2014","Tue Dec 30 19:48:50 GMT 2014","Wed Dec 31 11:48:50 PST 2014","Wed Dec 31 09:01:08 PST 2014","","","1380","100% (3/3)","100% (2/2)","100% (1/1)","http://tekinged.com/png-halves/dict-070-right.png","bekiit v.s. poor in aiming. See iit. ant. beketaut. --beklit el tekoi words which are irrelevant or not to the point.
bekfkl v.s. worried; insecure. --bekeklanf v.s. INCH. getting worried.
bekllekiakl v.s. (person) always wanting to remain independent, uninvolved or free from obligations. See meleakl.
bekililangel v.s. cry a lot; prone to crying. See langel.
bekititerachel v.s. REDUP. slippery; slimy. See imorech.
bekngiuk 1. N. mold. 2. v.s. (food) moldy or mildewed. --bekngiukel N.POSS. --bekngukang v.s. INCH is getting moldy or spoiled.
bekngukang v.s. INCH. is getting moldy or spoiled See bekngiuk,
bekoasech v.s. smell of juice or gravy. See uasech.
bekocheoch v.s. persistent in asking for things. See omecheoch.
beko(der)durech v.s. always sending others on errands; always willing to go on errands. See oldurech.
bekoderengesakl v.s. having sharp hearing. See orrenges.
bekoderuchel v.s. always ready or willing to go on errands. See oderuchel.
bekodurech v.s. syn. bekoderdurech.
bekoiuiuul v.s. (disease) contagious. See oliuul.
bekokoad v.s. prone to fighting. See okoad.
bekokuil (a rengul) v.s. king; generous. See kekuii. --blckikuii N.R.S. kindness; generosity.
bekolik v.s. (underarms) smelling sweaty. See olik2.
bekongesengasech (a rengul) v.s. REDUP. easily angered; excitable. See ngasech1.
beko(nge)senges v.s. obedient; tractable. See ngesenges.
bekongit v.s. always asking for things. See ongit1.
bekord v.s. about; approximately. E.g. Ng locha bekord el tela a rekil a rubak. I wonder what the approximate age of the old man might be.
bekoreomel v.s. smell of the forest; smell of fresh plants. See oreomel.
bekosenges v.s. syn. bekongesenges.
bekotangel v.s. have fat checks. See otang.
bekoteterau v.s. REDUP. easy to sell. See olterau."
"3XDSWAMB21RJ2RBNDDFQHB3GWIPCQG","3PFYYPJUJW4Z7TTVX8EEH7YSDOZZ2H","Transcribe the text from a Column of a Palauan Language Dictionary","We're trying to digitize a scanned dictionary of an endangered Pacific Island language","image, write, transcription, dictionary, palau, palauan, language","$0.30","Tue Dec 30 17:24:54 GMT 2014","1","BatchId:1776840;","3600","86400","Tue Jan 06 17:24:54 GMT 2015","","","3SUWZRL0MYC8BRABKXCPQEHCQGIE60","A33VCOSG7H0MCV","Approved","Tue Dec 30 20:10:55 GMT 2014","Tue Dec 30 20:40:34 GMT 2014","Wed Dec 31 12:40:34 PST 2014","Wed Dec 31 09:01:08 PST 2014","","","1779","100% (2/2)","100% (2/2)","100% (2/2)","http://tekinged.com/png-halves/dict-071-left.png","bekoungeroel V.S. continually scolding. See oungeroel.
beks-el. STEM N. POSS. See baks.
beksall V.A.S. (spearhead) is to be pounded and flattened. See omuks.
bekudasu V.S. resourceful in thinking; thoughtful; considerate. See omdasu.
bekadoud V.S. generous (usually, with Palauan money); charitable; receiving a lot of money (usually, Palauan); rich. See udoud.
bekukall V.A.S. is to be puffed up. See omkuuk1.
bekukokl V.S. rising early; be an early riser or early bird. See omkokl.
bekureor V.S. work a lot; hard-working; diligent. See ureor.
bekururau V.S. syn. bekururau.
bekutab V.S. having a good sense of direction; good at understanding implications of things. See tab.
bekuu N. type of turtle.
belal N. blue-lined surgeon fish (Acanthurus lineatus).
belailes N. type of tapioca. 
belalang N. step in stairs.
belalk V.S. feeling or expressing shame or fright. --belalk a medal  face express shame or fright. --belalk a rengul  feel shame or fright.
belating-el STEM N. POSS. See belatong.
belatong (Sp. plato dish, plate) N. plate; dish; bowl. --belatingel N.POSS. --belatong er a Merikel  stainless steel plate with several compartments.
Belau N. Palau. --omelau V.T. speak to (someone) in riddles; deceive; beat around the bush. --rechibelau N.PL. Palauans. --chaibebelau N. riddle. --chad er a Belau  Palauan (person). --tekoi er a Belau  Palauan (language).
belau N. tree in coffee family (Guettarda speciosa L.).
beldakl1 1. V.R.S. cooked in water. 2. N.R.S. fish cooked in water. See bodes. --omeldakl V.T. cook (fish) in water.
beldakl2 V.S. splattered all over with something. --omeldakl V.T. throw (something) so that it splatters.
beldechel-el STEM. N. POSS. See belduchel.
belduchel N. payment at ocheraol (=money-raising party). --beldechelel N. POSS. --omeldchel V.T. pay (particular amount) at oche-"
"3GVPRXWRPGT09CS89O26SNKG4XH7IF","3PFYYPJUJW4Z7TTVX8EEH7YSDOZZ2H","Transcribe the text from a Column of a Palauan Language Dictionary","We're trying to digitize a scanned dictionary of an endangered Pacific Island language","image, write, transcription, dictionary, palau, palauan, language","$0.30","Tue Dec 30 17:24:54 GMT 2014","1","BatchId:1776840;","3600","86400","Tue Jan 06 17:24:54 GMT 2015","","","3NPI0JQDAO4IAGADPO0TV08UOVQPT2","A33VCOSG7H0MCV","Approved","Tue Dec 30 18:55:50 GMT 2014","Tue Dec 30 19:24:27 GMT 2014","Wed Dec 31 11:24:27 PST 2014","Wed Dec 31 09:01:08 PST 2014","","","1717","100% (2/2)","100% (2/2)","100% (2/2)","http://tekinged.com/png-halves/dict-071-right.png","raol. --kabelduchel V.RECIP. pay at ocheraol together.
beleball V.A.S. is to be wound around with rope, cord, tape, etc. See belebel.
belebel N. cord or rope for winding (esp., used for starting outboard motor); shingles (disease). --belebelel N.POSS. --belebelel a mesil  rope for starting outboard motor. --omelebel V.T. wind rope, cord, tape, etc. around. --bllebel V.R.S. --beleball V.A.S. --kebelebel V.RECIP. (animals) get tethers tangled; (people) get limbs tangled (when wrestling).
belech-el STEM N. POSS. See balech.
belechall V.A.S. is to be hit with a slingshot. See balech.
belechel-el STEM N. POSS. See belochel.
belelengel V.S.REDUP. very long or tall. See lai.
beleng-el STEM N. OBLIG. POSS. See bal-.
Beliliou N. Peliliu island. --rechibeliliou N. PL. inhabitants of Peleliu.
belils V.S. (noise) high or piercing.
belkul N.OBLIG.POSS. meaning; purpose; function.  --belkul a tekoi  meaning of a word; proverb.  --belkul a Droteo  Droteos function.  --belkul tia el ongdibel  purpose of this gathering.  E.g.  Ngara belkul tiang?  What's the meaning of this/What's this for?  E.g. A Droteo a kmal medenge a betok el belkul a tekoi.  Droteo really knows a lot of proverbs.
bellachel  V.S.  purulent; festering; (woman's genitals) unclean and smelly; (starchy food) too soft or slimy. See lalech. E.g. Bellachel a delam! (lit.,) Your mother's unclean! (insult)
bellek N. devil; evil spirit.
bellekalek V.S. (face) looking sad or distressed.
bellemakl V.S. attentive; concentrating; deliberate.  See mellemakl.  --bellemakl a beluu  village is quiet or calm.
bellible V.R.S. removed; extracted. See omlibl.
belloi N. bitter yam (grows on vine).
belluchel V.R.S. mixed; dissolved. See omulech.
bellul N.OBLIG.POSS. rectum.
bellutel V.R.S. (clothes) turned inside out. See bult-.
belng-el STEM N. POSS. See bluu1.
beluchel 1. V.A.S. is to be shot with a slingshot. 2. N.A.S. Micronesian pigeon (Ducula oceanica). See balech.  --belechelel N.POSS. his pigeon (caught for food).
belt-el STEM N. OBLIG. POSS. See bult-."